<?xml version="1.0" encoding="UTF-8"?>
<shiporder xmlns:xsi="http://www.w3.org/2001/XMLSchema-instance" xsi:noNamespaceSchemaLocation="shiporder.xsd">
  <orderperson>orderperson</orderperson>
  <shipto>
    <name>name</name>
    <address>
      <city>city</city>
      <state>state</state>
      <country>country</country>
    </address>
  </shipto>
  <item>
    <title>title</title>
    <quantity>1</quantity>
    <price>0.0</price>
  </item>
</shiporder>
